{
  "fixture_id": "anthropic_plain_text_basic",
  "category": "plain_text",
  "description": "Single user text message with standard non-stream request.",
  "request": {
    "model": "claude-sonnet-4-5",
    "messages": [
      {
        "role": "user",
        "content": [
          {
            "type": "text",
            "text": "Summarize the project goal in one sentence."
          }
        ]
      }
    ],
    "max_tokens": 128,
    "stream": false
  }
}
