{
  "fixture_id": "anthropic_with_tool_definitions",
  "category": "tool_definitions",
  "description": "Request carries tool definitions and required tool_choice.",
  "request": {
    "model": "claude-sonnet-4-5",
    "messages": [
      {
        "role": "user",
        "content": [
          {
            "type": "text",
            "text": "Find build status for commit abc123."
          }
        ]
      }
    ],
    "tools": [
      {
        "name": "get_build_status",
        "description": "Lookup CI status by commit SHA.",
        "input_schema": {
          "type": "object",
          "properties": {
            "sha": {
              "type": "string"
            }
          },
          "required": [
            "sha"
          ]
        }
      }
    ],
    "tool_choice": {
      "type": "tool",
      "name": "get_build_status"
    },
    "max_tokens": 512,
    "stream": false
  }
}
